"number","short_description","description","urgency","impact","category","assignment_group","resolution"
"INC00025","Sales Agent unable to access merchant equipment options","Sales Agent experienced frequent network timeouts when selecting equipment for a merchant, causing delays in the onboarding process.",1,1,"Hardware","IT Support","Investigated the issue and found a misconfiguration in the equipment database linkage. Corrected the configuration, and now Sales Agents can see and select equipment options as intended."
"INC00068","Access denied error when trying to submit merchant data","Merchant data entered by Sales Agents in the Sales UI is not transferring to the Processing stage even after completion, halting the onboarding process for affected merchants.",2,2,"Software","Network Ops","Access permissions for the Sales Agent role were reviewed and corrected to ensure proper access to the fee configuration page, enabling seamless configuration of fees for merchant accounts."
"INC00329","Access Rights Restriction","An issue arose where certain hardware configurations selected by Sales Agents were not compatible with the fee calculation module, resulting in incorrect fee estimations and potential financial discrepancies.",1,3,"Software","IT Support","Database team investigated and found a synchronization issue between the fee configuration module and the additional location setup. Data was manually synced, and fees are now accurately displayed."
"INC00194","Inability to configure services for additional location","Sales Agent received a duplicate merchant ID error message when attempting to add a new location for an existing merchant ID. This prevented the agent from successfully completing the onboarding process.",2,2,"Access","IT Support","Resolved the issue by restarting the Sales UI server to ensure proper data retrieval."
"INC00305","Intermittent connection issues while configuring services","A software bug in the fee calculation module is causing incorrect fees to be applied to merchant accounts by Sales Agents. Several merchants have been overcharged.",2,2,"Software","IT Support","Investigated and corrected a database synchronization error, ensuring all merchant data is now saving accurately in the system."
"INC00450","Merchant unable to e-sign agreement due to login error","An error occurs when a Sales Agent tries to save merchant data in the Sales UI, leading to incomplete information and hindered onboarding process.",2,2,"Software","Network Ops","Conducted a thorough review of the fee calculation algorithm, identified a logic flaw, and applied a fix to ensure accurate processing fee calculation for the merchant."
"INC00092","Unable to link new location to existing merchant ID","Merchants encountered an access permission error while trying to upload and e-sign the Merchant Agreement PDF, preventing them from progressing to the processing stage and delaying onboarding completion.",2,3,"Access","IT Support","Identified a rendering issue with the PDF viewer component. Updated the PDF viewer software to the latest version, resolving the distortion problem for all merchants."
"INC00346","Access permission error for Merchant Agreement PDF upload","Sales Agents reported missing equipment options in the selection dropdown menu, limiting their ability to choose the appropriate devices for merchants.",2,1,"Software","Network Ops","Access permissions for the Sales Agent role were reviewed and corrected to ensure proper access to the fee configuration page, enabling seamless configuration of fees for merchant accounts."
"INC00202","Network timeout errors during merchant data submission","Some merchants receive authentication errors when attempting to log in to the Customer UI to review and e-sign the Merchant Agreement, preventing access to the document.",1,1,"Software","IT Support","Investigated and fixed the issue by updating the UI application, ensuring that upon login, the Merchant now correctly sees the agreement for review without encountering a blank screen."
"INC00154","Sales Agent unable to access merchant equipment options","The Sales UI is not loading properly for a new Sales Agent attempting to onboard a merchant, causing delays in merchant data input.",2,2,"Hardware","IT Support","The configuration settings for fees and services were manually verified in the backend system. A script was run to reapply the correct configurations for the new location, ensuring alignment with the merchant agreement."
"INC00453","Merchant unable to e-sign agreement","Sales Agent encountered an error while configuring POS terminals for a merchant, leading to incorrect settings. Merchant transactions are impacted.",2,3,"Hardware","IT Support","Resolved by clearing browser cache and cookies, ensuring proper functionality of the login button."
"INC00102","Equipment Configuration Freeze on Legacy Browser","Sales Agent experienced frequent network timeouts when selecting equipment for a merchant, causing delays in the onboarding process.",2,1,"Hardware","IT Support","Conducted network diagnostics, discovered a bottleneck in the network infrastructure. Implemented QoS settings to prioritize data submission traffic and alleviate timeouts."
"INC00116","Merchant ID not recognized for additional location","Sales Agent raised a concern that the merchant data being displayed in the Sales UI is showing incorrect information not matching the actual details provided.",2,1,"Hardware","IT Support","Developers identified a bug in the linking functionality and released a hotfix. Sales Agent successfully added the new location to the existing merchant ID."
"INC00093","Access denied error when trying to submit merchant data","During equipment selection for a new merchant, Sales Agents are experiencing an issue where the dropdown menu for selecting equipment models is not loading, causing delays in onboarding.",3,2,"Network","IT Support","Identified and fixed the software bug causing incorrect fee calculations. Issued refunds to affected merchants and verified correct fee application."
"INC00103","Fee configuration tool malfunction in Sales UI","Sales Agents noticed that the service fees configured for a merchant were not displaying accurately on the summary page, potentially causing confusion during the final review with the merchant.",3,2,"Access","IT Support","Reset the merchant's login credentials and provided temporary access to review and e-sign the agreement. Investigated the root cause for further prevention."
"INC00104","API endpoint returning 500 error for merchant data upload","The Merchant reported a touchscreen malfunction on their device, making it impossible for them to e-sign the agreement in the Customer UI, hindering the onboarding progress.",2,3,"Software","Network Ops","Performed a system cache refresh to reload the merchant data and ensured proper data mapping to display information accurately in the Sales UI."
"INC00243","Network timeout errors during merchant data submission","Merchants are unable to view the PDF Merchant Agreement after logging in to the Customer UI.",2,2,"Access","IT Support","Developers identified a bug in the linking functionality and released a hotfix. Sales Agent successfully added the new location to the existing merchant ID."
"INC00297","Intermittent network connectivity affecting agreement review","After a merchant e-signs the agreement, their data is not transitioning to the PROCESSING stage as expected. This is causing delays in the onboarding process and preventing further actions.",3,2,"Hardware","IT Support","Discovered a backend database synchronization issue causing the data loss and restored the fee configuration for the affected merchant."
"INC00163","Sales UI not loading for Sales Agent","Sales Agent encountered an issue where they were unable to select any equipment options while onboarding a new merchant.",2,3,"Software","IT Support","Access permissions for the Sales Agent role were reviewed and corrected to ensure proper access to the fee configuration page, enabling seamless configuration of fees for merchant accounts."
"INC00302","Fees/services configuration missing for new location","Sales Agent received a duplicate merchant ID error message when attempting to add a new location for an existing merchant ID. This prevented the agent from successfully completing the onboarding process.",2,1,"Hardware","IT Support","Conducted network diagnostics, discovered a bottleneck in the network infrastructure. Implemented QoS settings to prioritize data submission traffic and alleviate timeouts."
"INC00382","Payment terminal integration failure during merchant setup","Sales Agent encountered an issue where merchant data input was not saving correctly in the Sales UI, leading to incomplete merchant profiles and delays in onboarding.",2,1,"Software","Network Ops","The issue was identified as a compatibility issue with the specific POS model and was resolved by updating the system to support the new equipment."
"INC00275","Access permission error for e-signing Merchant Agreement","During equipment selection for a new merchant, Sales Agents are experiencing an issue where the dropdown menu for selecting equipment models is not loading, causing delays in onboarding.",2,2,"Software","Network Ops","IT support granted the necessary access permissions to the affected sales agents, allowing them to successfully configure fees and services for the merchants without encountering any further permission errors."
"INC00322","Access permission error preventing merchant fee configuration","Sales Agent noticed that any changes made to fees/services configurations for a merchant are not saving properly in the system.",3,2,"Software","IT Support","Reset authentication tokens for affected merchants. Conducted a thorough review of the authentication system to ensure proper functionality and prevent future login issues."
"INC00167","Fee Configuration Permission Denial for New Sales Agent","A critical failure in configuring service fees by a Sales Agent has caused all merchant accounts to reflect incorrect service charges. Financial discrepancies detected.",2,3,"Access","IT Support","Identified a bug in the equipment selection module code and applied a patch to resolve the unresponsiveness issue."
"INC00065","Sales Agent unable to access merchant equipment options","During the onboarding process for a new merchant location, Sales Agent selected equipment options but encountered a system issue where the selections were not being saved despite multiple attempts.",2,1,"Software","IT Support","Resolved by clearing the browser cache and reloading the Customer UI. PDF now loads successfully."
"INC00195","Sales Agent unable to access fee configuration page","Sales Agent using a legacy browser experienced a freeze while configuring equipment, leading to incomplete data entry; Sales Agent affected.",2,2,"Network","IT Support","Guided the Merchant to the correct location of the e-signature field within the PDF, resolving the issue."
"INC00131","Incorrect fees calculation for bundled services","Multiple Sales Agents experienced intermittent network connection problems while configuring services for merchants, leading to incomplete configurations and frustration.",1,2,"Hardware","IT Support","The issue was identified as a server-side bug causing the error. Developers fixed the bug and deployed a patch to resolve the 500 error."
"INC00415","Network timeout errors during merchant data submission","An issue arose where certain hardware configurations selected by Sales Agents were not compatible with the fee calculation module, resulting in incorrect fee estimations and potential financial discrepancies.",2,1,"Software","IT Support","The issue was identified as a data synchronization error and was resolved by refreshing the equipment database to populate the missing dropdown options for selection."
"INC00490","Sales Agent unable to access onboarding portal for merchant ID","Sales Agent faced network connectivity issues while trying to add a new location for an existing merchant ID. The system repeatedly timed out during the location addition process, causing frustration and delays.",3,2,"Network","IT Support","A backend synchronization issue was identified and resolved by initiating a manual sync process. Sales Agent confirmed that the fees and services configurations were now accurately displayed."
"INC00224","Equipment selection dropdown not populating","Sales Agent noticed that any changes made to fees/services configurations for a merchant are not saving properly in the system.",3,2,"Software","Network Ops","IT support granted the necessary access permissions to the affected sales agents, allowing them to successfully configure fees and services for the merchants without encountering any further permission errors."
"INC00261","Hardware failure on Sales Agent's device","Sales Agent raised a concern that the merchant data being displayed in the Sales UI is showing incorrect information not matching the actual details provided.",2,1,"Software","IT Support","The database was checked for any existing duplicate merchant IDs. The system was updated to include a validation check to prevent the reoccurrence of duplicate IDs during onboarding."
"INC00286","Fee Calculation Bug","Sales Agents noticed that the service fees configured for a merchant were not displaying accurately on the summary page, potentially causing confusion during the final review with the merchant.",2,2,"Network","IT Support","Performed a system cache refresh to reload the merchant data and ensured proper data mapping to display information accurately in the Sales UI."
"INC00461","Merchant data not transitioning to PROCESSING stage after e-signing","The Sales UI is not loading properly for a new Sales Agent attempting to onboard a merchant, causing delays in merchant data input.",2,2,"Network","IT Support","The issue was resolved by updating the system database to include the 'ABC-2000' POS terminal model as an available option for selection."
"INC00203","Fees Calculation Mismatch for Specific Equipment Bundle","After a merchant e-signs the agreement, their data is not transitioning to the PROCESSING stage as expected. This is causing delays in the onboarding process and preventing further actions.",2,1,"Software","IT Support","Performed troubleshooting on the scanner, identified a hardware fault, and replaced the malfunctioning component. Subsequently, the Sales Agent was able to scan and upload the required documents without further impediments."
"INC00484","Error saving merchant data in Sales UI","Merchant unable to locate the e-signature field within the Merchant Agreement PDF for completing the onboarding process.",2,1,"Software","IT Support","Network Ops team investigated and found a faulty network switch. Replaced the switch, stabilized the connection, and recovered lost data."
"INC00365","Merchant data displaying incorrectly","After a merchant e-signs the agreement, their data is not transitioning to the PROCESSING stage as expected. This is causing delays in the onboarding process and preventing further actions.",2,1,"Software","IT Support","Traced the issue to a synchronization problem between the Sales UI and the agreement generation module. Conducted a data sync and patch to ensure that configured fees and services now correctly appear in the final agreement."
"INC00343","Sales Agent unable to access fee configuration page","Intermittent occurrences of 500 internal server errors reported when making API calls for merchant onboarding, disrupting the data submission flow.",2,1,"Software","IT Support","Frontend team identified a caching issue causing the equipment dropdown not to load. Cache was cleared, and Sales Agent can now select equipment for the new location."
"INC00478","Fees/services configuration missing for new location","Sales Agent faced network connectivity issues while trying to add a new location for an existing merchant ID. The system repeatedly timed out during the location addition process, causing frustration and delays.",1,3,"Software","IT Support","The issue was rectified by rolling back the incorrect fees, conducting a thorough audit of all recent fee changes, and ensuring the accurate fees were applied."
"INC00338","Error message 'Location already exists' when adding new location","Sales Agent encountered an issue where a specific POS terminal model, 'ABC-2000', could not be selected while configuring equipment for a merchant.",1,3,"Hardware","IT Support","Identified the network issue as a temporary outage due to a hardware failure. Network Ops team swiftly resolved the hardware problem, restored connectivity, and ensured the successful submission of location data for the merchant ID."
"INC00425","Fee Configuration Permission Denial for New Sales Agent","An issue was detected where the fee configuration tool within the Sales UI was malfunctioning, leading to incorrect fee structures being applied to merchant accounts, impacting financial agreements.",2,2,"Software","IT Support","Assisted the Merchant in resetting their password and provided guidance on securely accessing the UI, allowing them to successfully e-sign the agreement."
"INC00049","Sales Agent unable to access fee configuration page","New Sales Agent reported inability to configure fees/services due to access denial, hindering merchant onboarding process; Sales Agent affected.",2,2,"Access","Network Ops","Conducted network diagnostics, discovered a bottleneck in the network infrastructure. Implemented QoS settings to prioritize data submission traffic and alleviate timeouts."
"INC00204","Fees/services configuration not reflecting for new location","Sales Agent reported that the Sales UI is not loading merchant data when trying to onboard a new merchant.",1,1,"Software","IT Support","Implemented a software patch to fix the calculation algorithm, ensuring accurate fee configurations for all new and existing merchant accounts in the system."
"INC00089","API endpoint returning 500 error for merchant creation","New Sales Agent reported inability to configure fees/services due to access denial, hindering merchant onboarding process; Sales Agent affected.",2,1,"Access","IT Support","Access permissions were reassigned to the Sales Agent's role after a review, allowing seamless fee configuration."
"INC00096","Hardware compatibility issue with fee calculation module","Sales Agent received a duplicate merchant ID error message when attempting to add a new location for an existing merchant ID. This prevented the agent from successfully completing the onboarding process.",2,2,"Software","IT Support","Frontend team identified a caching issue causing the equipment dropdown not to load. Cache was cleared, and Sales Agent can now select equipment for the new location."
"INC00003","Error in Equipment Configuration","After a merchant e-signs the agreement, their data is not transitioning to the PROCESSING stage as expected. This is causing delays in the onboarding process and preventing further actions.",3,2,"Software","Network Ops","A bug in the equipment selection module was identified and fixed by the development team. Sales Agent was instructed to reselect the equipment and verify successful saving."
"INC00389","PDF not loading for Merchant Agreement review","Sales Agent encountered an error while trying to onboard an additional location for an existing merchant ID. The system failed to save the new location details.",2,2,"Software","IT Support","The problem was resolved by performing a system cache refresh, ensuring that the equipment selection dropdown functioned properly and allowed Sales Agents to choose equipment efficiently."
"INC00283","Inability to configure services for additional location","Merchant reported being unable to e-sign the Merchant Agreement due to an access permission error in the UI, halting the onboarding process.",2,1,"Hardware","IT Support","Discovered a backend API communication issue preventing data transfer. Resolved the API connection problem, allowing merchant data to flow seamlessly to the Processing stage for further processing."
"INC00180","Unable to select specific POS terminal model","Intermittent occurrences of 500 internal server errors reported when making API calls for merchant onboarding, disrupting the data submission flow.",2,1,"Access","IT Support","The problem was resolved by performing a system cache refresh, ensuring that the equipment selection dropdown functioned properly and allowed Sales Agents to choose equipment efficiently."
"INC00034","Unable to add new equipment for merchant","Some merchants receive authentication errors when attempting to log in to the Customer UI to review and e-sign the Merchant Agreement, preventing access to the document.",3,1,"Software","IT Support","Resolved the issue by clearing the browser cache and refreshing the page, ensuring the PDF now loads correctly for the Merchant."
"INC00497","Equipment Configuration Freeze on Legacy Browser","Merchant facing difficulties in submitting the e-signed Merchant Agreement through the UI, hindering the onboarding process.",1,2,"Hardware","IT Support","Access permissions for the Sales Agent role were reviewed and corrected to ensure proper access to the fee configuration page, enabling seamless configuration of fees for merchant accounts."
"INC00127","Network timeout errors during merchant data submission","During the data upload process for a new merchant, the API endpoint consistently returns a 500 error, preventing sales agents from successfully onboarding the merchant.",3,2,"Software","IT Support","Investigated server-side PDF rendering issue and implemented a fix to ensure proper loading for all users."
"INC00217","Hardware failure on Sales Agent's device","An error in the system caused incorrect fees to be applied to a merchant's account, resulting in financial discrepancies and potential loss of trust.",2,1,"Hardware","Network Ops","Network logs were analyzed, and a bottleneck in the network infrastructure was identified. Network Ops team optimized the network configuration, resolving the connectivity issue for the Sales Agent."
"INC00122","Sales Agent unable to access onboarding portal for merchant ID","New Sales Agent reported inability to configure fees/services due to access denial, hindering merchant onboarding process; Sales Agent affected.",1,1,"Software","IT Support","The access issue was traced back to a permission setting error and was resolved by adjusting the agent's role permissions to grant access to the required module."
"INC00148","Error saving merchant data in Sales UI","While configuring equipment for a new merchant, Sales Agent experienced network timeouts leading to delays in selecting the required hardware, affecting the efficiency of onboarding processes.",2,1,"Software","IT Support","Investigated server-side PDF rendering issue and implemented a fix to ensure proper loading for all users."
"INC00135","Sales Agent unable to access fee configuration module","Upon opening the Merchant Agreement PDF in the Customer UI, the text appears garbled and unreadable for merchants.",2,2,"Software","IT Support","The access issue was traced back to a permission setting error and was resolved by adjusting the agent's role permissions to grant access to the required module."
"INC00043","Unable to add new location due to POS terminal malfunction","Merchant experiencing issues with loading the Merchant Agreement PDF for review and e-signing.",1,2,"Software","IT Support","Investigated API logs, identified a server-side issue causing data retrieval failures. Applied a patch to the API server to resolve the issue."
"INC00407","Payment terminal integration failure during merchant setup","Sales Agent reported that when configuring bundled services for a merchant, the system was incorrectly calculating the total fees, leading to discrepancies in the final pricing.",3,2,"Software","IT Support","The issue was identified as a data synchronization error and was resolved by refreshing the equipment database to populate the missing dropdown options for selection."
"INC00294","Equipment selection dropdown missing options","Sales Agent received a duplicate merchant ID error message when attempting to add a new location for an existing merchant ID. This prevented the agent from successfully completing the onboarding process.",2,2,"Software","Network Ops","Resolved the issue by clearing the browser cache and refreshing the page, ensuring the PDF now loads correctly for the Merchant."
"INC00247","Unable to select equipment for merchant","Sales Agent reported that the Sales UI is not loading merchant data when trying to onboard a new merchant.",1,2,"Access","IT Support","Identified a database inconsistency causing the false error message. Resolved the issue by correcting the location mapping in the database, allowing the Sales Agent to proceed with adding the new location."
"INC00477","Merchant data not transitioning to PROCESSING stage after e-signing","Intermittent network connectivity issues are disrupting the Merchant's ability to smoothly review the agreement on the Customer UI, causing delays and frustration.",2,1,"Software","Network Ops","Reset the merchant's login credentials and provided temporary access to review and e-sign the agreement. Investigated the root cause for further prevention."
"INC00225","Merchant Agreement PDF displaying garbled text","Sales Agent encounters an issue where equipment selection dropdown menu is unresponsive for a specific merchant profile.",2,2,"Software","IT Support","Identified a permission issue specific to the Sales Agent's account and provided the necessary access rights, allowing seamless equipment selection for merchant onboarding."
